{
  "$schema": "https://json-schema.org/draft/2020-12/schema",
  "$id": "https://github.com/n1hub/specs/schemas/public-verification-matrix.schema.json",
  "title": "Public Verification Matrix",
  "type": "object",
  "additionalProperties": false,
  "required": [
    "version",
    "reviewed_at",
    "purpose",
    "checks",
    "review_commands"
  ],
  "properties": {
    "version": {
      "type": "string",
      "minLength": 1
    },
    "reviewed_at": {
      "type": "string",
      "format": "date"
    },
    "purpose": {
      "type": "string",
      "minLength": 1
    },
    "checks": {
      "type": "array",
      "minItems": 8,
      "items": {
        "type": "object",
        "additionalProperties": false,
        "required": [
          "id",
          "summary",
          "commands",
          "protects",
          "strongest_surfaces",
          "failure_modes_prevented"
        ],
        "properties": {
          "id": {
            "type": "string",
            "minLength": 1
          },
          "summary": {
            "type": "string",
            "minLength": 1
          },
          "commands": {
            "type": "array",
            "minItems": 1,
            "items": {
              "type": "string",
              "minLength": 1
            }
          },
          "protects": {
            "type": "array",
            "minItems": 1,
            "items": {
              "type": "string",
              "minLength": 1
            }
          },
          "strongest_surfaces": {
            "type": "array",
            "minItems": 1,
            "items": {
              "type": "string",
              "minLength": 1
            }
          },
          "failure_modes_prevented": {
            "type": "array",
            "minItems": 1,
            "items": {
              "type": "string",
              "minLength": 1
            }
          }
        }
      }
    },
    "review_commands": {
      "type": "array",
      "minItems": 1,
      "items": {
        "type": "string",
        "minLength": 1
      }
    }
  }
}
